<?xml version="1.0" encoding="UTF-8"?>
<tns:ItemList xmlns:tns="http://www.example.org/ItemList" xmlns:xsi="http://www.w3.org/2001/XMLSchema-instance" xsi:schemaLocation="http://www.example.org/ItemList ../XSDS/Item.xsd ">
  <tns:ItemInfo>
    <tns:itemId>6</tns:itemId>
    <tns:itemName>top</tns:itemName>
    <tns:storeId>9001</tns:storeId>
    <tns:storeName>sunny</tns:storeName>
    <tns:price>30.0</tns:price>
    <tns:description>fv</tns:description>
    <tns:quantity>3</tns:quantity>
  </tns:ItemInfo>
</tns:ItemList>